,Орфография,Unnamed: 1,Пунктуация,Unnamed: 3,Синтаксис,Unnamed: 5,Грамматика,Unnamed: 7,Лексика,Unnamed: 9,Морфология,Unnamed: 11,Морфемика и слоообразование,Unnamed: 13,Фонетика и орфоэпия,Unnamed: 15,Текст. Создание текстов различных стилей,Unnamed: 17,Навыки и умения,Unnamed: 19,Работа с текстом,Unnamed: 21,Сочинение,Unnamed: 23
0,Корневая омонимия. Омонимия частей речи,1,Знаки препинания при прямой речи,101.0,Словосочетание,201.0,Формы именительного падежа множественного числа существительных,301.0,Однозначные и многозначные слова,401.0,Существительное,501.0,Морфема,601.0,Звук и буква,701.0,Текст. Смысловая и композиционная целостность текста,801.0,Владение всеми видами речевой деятельности (аудирование и чтение),901.0,Вводные слова как средство связи,1001.0,Знание структуры итогового сочинения,1101.0
1,Правописание проверяемых гласных в корне слова,2,"Пунктуация в предложениях с однородными членами, связанными бессоюзной связью",102.0,Виды связи словосочетания. Согласование,202.0,Формы родительного падежа множественного числа существительных,302.0,Прямое и переносное значения слова,402.0,Собственные и нарицательные существительные,502.0,Чередования гласных,602.0,Фонетическая транскрипция,702.0,Тема,802.0,"Понимание информации устного и письменного сообщения (темы, основной мысли, основной и дополнительной информации)",902.0,Формы слова как средство связи,1002.0,Умение комментировать авторские высказывания на различные темы,1102.0
2,Форма слова. Однокоренные слова,3,"Пунктуация в предложениях с однородными членами, связанными одиночным соединительным или разделительным союзом",103.0,Виды связи словосочетания. Управление,203.0,Нормативное образование и употребление глагольных форм,303.0,Омонимы,403.0,Склонение существительных.,503.0,Чередования согласных,603.0,Гласные звуки и гласные буквы,703.0,Микротема,803.0,"Владение разными видами чтения (поисковым, просмотровым, ознакомительным, изучающим) текстов разных стилей и жанров",903.0,Однокоренные слова как средство связи,1003.0,Умение формулировать свою позицию и доказывать её,1103.0
3,Правописание непроверяемых гласных в корне слова,4,"Пунктуация в предложениях с однородными членами, связанными противительным союзом",104.0,Виды связи словосочетания. Примыкание,204.0,Нормативное употребление повелительного наклонения глаголов,304.0,Синонимы,404.0,Род существительных,504.0,Корень,604.0,Согласные звуки и согласные буквы,704.0,Приёмы сжатия. Исключение. Замена. Обобщение,804.0,Восприятие на слух текстов разных стилей и жанров,904.0,Союз как средство связи,1004.0,,
4,"Правописание чередующихся гласных в корне слова, зависящих от суффикса -а-",5,"Пунктуация в предложениях с однородными членами, связанными повторяющимися союзами",105.0,Синонимичные словосочетания,205.0,Нормативное употребление сравнительной и превосходной степени имён прилагательных,305.0,Антонимы,405.0,Несклоняемые существительные,505.0,Словообразующие и формообразующие морфемы,605.0,Глухие и звонкие согласные звуки,705.0,Основная мысль,805.0,"Владение разными видами аудирования (выборочным, ознакомительным, детальным)",905.0,Частицы как средство связи,1005.0,,
5,"Правописание чередующихся гласных в корне слова, зависящих от согласной буквы на конце корня",6,"Пунктуация в предложениях с однородными членами, связанными двойным союзом",106.0,Способы выражения подлежащего,206.0,Нормативное образование и употребление причастий и деепричастий,306.0,"Устаревшая лексика. Архаизмы, историзмы",406.0,Разносклоняемые существительные,506.0,Приставка,606.0,Позиционное оглушение / озвончение,706.0,Проблема. Способы формулировки проблемы,806.0,Умение сопоставлять и сравнивать речевые высказывания с точки зрения их содержания и стилистических особенностей,906.0,,,,
6,"Правописание чередующихся гласных в корне слова, зависящих от ударения",7,"Пунктуация в предложениях с однородными членами, соединёнными попарно",107.0,Способы выражения сказуемого,207.0,Нормативное образование и употребление местоимений,307.0,Неологизмы,407.0,Существительные общего рода,507.0,Суффикс,607.0,Твердые и мягкие согласные звуки,707.0,Вступление,807.0,"Умение воспроизводить прослушанный или прочитанный текст (план, пересказ, конспект, аннотация)",907.0,,,,
7,"Правописание чередующихся гласных в корне слова, зависящих от лексического значения",8,"Пунктуация в предложениях с однородными членами, соединёнными попарно",108.0,Простое глагольное сказуемое,208.0,Формы собирательных числительных,308.0,Общеупотребительная лексика и лексика ограниченного употребления,408.0,Аббревиатуры,508.0,Интерфикс,608.0,Позиционное смягчение согласных,708.0,Комментарий,808.0,"Умение создавать устные и письменные тексты разных типов, стилей речи и жанров с учетом замысла и ситуации общения",908.0,,,,
8,Правописание неизменяемых приставок,9,Пунктуация в предложениях с однородными членами и обобщающим словом,109.0,Составное глагольное сказуемое,209.0,"Ошибки, связанные с неправильным употреблением падежной формы имени существительного с предлогом",309.0,Диалектизмы,409.0,Число существительных,509.0,Постфикс,609.0,Упрощение групп согласных (непроизносимый согласный),709.0,Иллюстрация. Пояснение,809.0,Способность свободно излагать свои мысли в устной и письменной форме,909.0,,,,
9,Правописание изменяемых приставок,10,Однородные и неоднородные определения,110.0,Составное именное сказуемое,210.0,"Ошибки, связанные с нарушением связи между подлежащим и сказуемым",310.0,"Специальная лексика. Термины, профессионализмы",410.0,Существительные singularia и pluralia tantum,510.0,Окончание,610.0,Ударение в существительных,710.0,Смысловая связь и её анализ,810.0,"Способность соблюдать нормы построения текста (логичность, последовательность, связность, соответствие теме и др.)",910.0,,,,
10,Глухие и звонкие звуки,11,Знаки препинания при обращении,111.0,Простое предложение. Двусоставные предложения,211.0,"Ошибки в ошибки, связанные с нарушением видовременной соотнесённости глагольных форм",311.0,Жаргонная лексика. Сленг,411.0,Падежи существительных,511.0,Основа,611.0,Ударение в прилагательных,711.0,"Способы отсылки к тексту. Пересказ, цитата, номера предложений",811.0,Способность адекватно выражать свое отношение к фактам и явлениям окружающей действительности,911.0,,,,
11,"Гласные в приставках, зависящие от ударения",12,Пунктуация в предложениях с вводными конструкциями,112.0,Распространённые предложения,212.0,Ошибки в употреблении имени числительного,312.0,"Стилистические пласты лексики. Нейтральная, высокая, книжная, разговорная, просторечная",412.0,Окончание существительных,512.0,Сокращение производящей основы,612.0,Ударение в наречиях,712.0,Авторская позиция,812.0,"Владение различными видами монолога (повествование, описание, рассуждение, сочетание разных видов монолога)",912.0,,,,
12,Гласные в приставках ПРО-/ПРА-,13,Пунктуация в предложениях с обособленными определениями,113.0,Осложнённые предложения,213.0,Ошибочное словообразование,313.0,Исконно русская лексика,413.0,Глагол,513.0,Сложение,613.0,Ударение в глаголах,713.0,Тезис. Собственная позиция,813.0,Владение различными видами диалога,913.0,,,,
13,Правописание приставок ПРЕ-/ПРИ-,14,Пунктуация в предложениях с обособленными приложениями,114.0,Дополнение,214.0,Нарушение согласования,314.0,Заимствованная лексика,414.0,Переходные и непереходные глаголы,514.0,Приставочный способ образования,614.0,Ударение в причастиях,714.0,Обоснование (аргументация),814.0,"Соблюдение в практике речевого общения основных орфоэпических, лексических норм современного русского языка",914.0,,,,
14,Омонимия приставок ПРЕ-/ПРИ-,15,Пунктуация в предложениях с обособленными обстоятельствами.,115.0,Прямое и косвенное дпоплнение,215.0,Нарушение управления,315.0,Старославянизмы,415.0,Возвратные и невозвратные глаголы,515.0,Суффиксальный способ образования,615.0,Ударение в деепричастиях,715.0,Заключение,815.0,"Соблюдение в практике речевого общения основных грамматических, стилистических норм современного русского языка",915.0,,,,
15,"Слова, не зависящие от значения приставок ПРЕ-/ПРИ-, где подобное сочетание букв является частью корня",16,Пунктуация в предложениях с обособленными обстоятельствами,116.0,Определение,216.0,Нарушение способа выражения сказуемого в отдельных конструкциях,316.0,Фразеологизм,416.0,Вид глагола,516.0,Приставочно-суффиксальный способ образования,616.0,,,Абзац,816.0,Соблюдение основных правил орфографии и пунктуации в процессе письменного общения,916.0,,,,
16,Гласные Ы/И после приставок,17,Пунктуация в предложениях с уточняющими членами предложения,117.0,Согласованное и несогласованное определение,217.0,Первообразные прилагательные,317.0,Паронимы,417.0,Наклонения глагола,517.0,Нулевая суффиксация,617.0,,,Смысловая цельность и последовательность изложения,817.0,Распознавать уровни и единицы языка в предъявленном тексте и видеть взаимосвязь между ними,917.0,,,,
17,Иностранные приставки,18,"Пунктуация в предложениях с конструкциями, присоединяющимися при помощи КАК",118.0,Обстоятельство,218.0,Производная и производящая основа,318.0,Метафора. Олицетворение,418.0,Время глагола,518.0,Постфиксация,618.0,,,"Средства связи предложений. Лексические, морфологические, синтаксические",818.0,"Анализировать языковые средства, использованные в тексте",918.0,,,,
18,Правописание Ъ после приставок,19,Знаки препинания в ССП,119.0,Разряды обстоятельства по значению,219.0,Морфемный разбор,319.0,Эпитет,419.0,Лицо глагола,519.0,Переход из одной части речи в другую,619.0,,,"Учебно-научный, деловой, публицистический стили, разговорная речь, язык художественной литературы",819.0,Комментирование авторских высказываний на различные темы (в том числе о богатстве и выразительности русского языка),919.0,,,,
19,Правописание Ь в корнях,20,Знаки препинания в ССП с ОВЧ,120.0,"Обстоятельства места, времени, причины, цели, условия, уступки, образа действия, меры и степени",220.0,Лексический разбор,320.0,Сравнение,420.0,Спряжение глагола,520.0,Словообразовательный разбор слова,620.0,,,"Типы речи. Повествование, описание, рассуждение",820.0,Отмечать отличия языка художественной литературы от других разновидностей современного русского языка,920.0,,,,
20,"Суффиксы -ОНЬК-, -ЕНЬК-",21,Знаки препинания в ССП с общей придаточной частью,121.0,Приложение,221.0,Звукопись,321.0,Метонимия,421.0,Прилагательное,521.0,Разговорный стиль речи,621.0,,,Интонация. Темп чтения,821.0,Использование синонимические ресурсы языка для более точного выражения мысли и усиления выразительности речи,921.0,,,,
21,Гласные в суффиксах существительного после шипящей буквы,22,Знаки препинания в сложном вопросительном предложении,122.0,Односоставные предложения,222.0,Точка с запятой в БСП,322.0,Синекдоха,422.0,"Разряды прилагательных. Качественные, относительные, притяжательные",522.0,Научный стиль речи,622.0,,,Речевая ситуация,822.0,Иметь представление об историческом развитии русского языка и истории русского языкознания,922.0,,,,
22,Суффиксы отымённых и отглагольных существительных -ОВ-/-ЁВ-,23,Знаки препинания в сложном восклицательном предложении,123.0,Назывные предложения,223.0,Определение проблемы,323.0,Гипербола,423.0,Склонение прилагательных,523.0,Официально-деловой стиль речи,623.0,,,Монологическая и даилогическая речь,823.0,Выражать согласие или несогласие с мнением собеседника в соответствии с правилами ведения диалогической речи,923.0,,,,
23,Суффиксы существительных -ИНК-,24,Знаки препинания в сложном безличном предложении,124.0,Определённо-личные предложения,224.0,Формулирование примеров-иллюстраций из прочитанного текста,324.0,Литота,424.0,Степени сравнения прилагательных,524.0,Художественный стиль речи,624.0,,,Виды чтения. Использование различных видов чтения в зависимости от коммуникативной задачи и характера текста,824.0,Дифференцировать главную и второстепенную информацию информацию в прослушанном тексте,924.0,,,,
24,Суффиксы существительных -ОК-,25,Знаки препинания в сложном назывном предложении,125.0,Обобщённо-личные предложения,225.0,Пояснение примеров-иллюстраций,325.0,Ирония. Сарказм,425.0,Полные и краткие прилагательные,525.0,Публицистический стиль речи,625.0,,,Аудирование,825.0,Проводить самостоятельный поиск текстовой и нетекстовой информации,925.0,,,,
25,Суффиксы существительных -ЕК-/-ИК-,26,Знаки препинания в СПП,126.0,Неопределённо личные предложения,226.0,Смысловая связь между примерами-иллюстрациями и её анализ,326.0,Перифраз,426.0,Числительное,526.0,Жанр текста,626.0,,,"Автор, герой, рассказчик",826.0,Отбирать и анализировать полученную информацию,926.0,,,,
26,Суффиксы существительных -ЕЦ-/-ИЦ-,27,Знаки препинания в СПП с несколькими придаточными,127.0,Безличные предложения,227.0,Определение авторской позиции,327.0,Употребление слова в несвойственном ему значении,427.0,"Разряды числительных. Целые, дробные, собирательные, порядковые. Простые, составные",527.0,Типы речи,627.0,,,Соблюдение фактологической точности,827.0,Оценивать стилистические ресурсы языка,927.0,,,,
27,Суффикс существительного -К- в сочетаниях -ИНК-/-ЕНК-,28,"Знаки препинания в СПП с несколькими придаточными, связанными повторяющимся союзом",128.0,Неполные предложения. Элипсис,228.0,Формулирование и обоснование своей позиции,328.0,"Неразличение оттенков значения, вносимых в слово приставкой и суффиксом",428.0,Склонение числительных,528.0,Морфологические признаки,628.0,,,,,Сохранять стилевое единство при создании текста заданного функционального стиля,928.0,,,,
28,Суффиксы существительных -ИНСТВ-/-ЕНСТВ-,29,Знаки препинания в СПП с однородными придаточными,129.0,Однородные и неоднородные члены,229.0,Нормативное образование и употребление форм причастий и деепричастий,329.0,Неразличение синонимичных слов,429.0,Местоимение,529.0,Лексические признаки,629.0,,,,,Владеть умениями информационно перерабатывать прочитанные и прослушанные тексты и представлять их в виде тезисов,929.0,,,,
29,Суффиксы существительных -УШК-/-ЫШК-/-ИШК-,30,Запятая на стыке двух союзов,130.0,Сложное предложение,230.0,,,Нарушение лексической сочетаемости,430.0,"Разряды местоимения. Личные, возвратное, притяжательные, указательные, определительные, относительно-вопросительные, отрицательные, неопределенные",530.0,Синтаксические признаки,630.0,,,,,"Соблюдать культуру чтения, говорения, аудирования и письма",930.0,,,,
30,Суффиксы существительных -ИН-/-ИЗН-,31,Знаки препинания в предложениях с разными видами связи,131.0,Типы придаточных предложений,231.0,,,Употребление лишних слов. Плеоназм. Речевая недостаточность,431.0,"Лицо, род, число, склонение местоимения",531.0,Средства выразительности,631.0,,,,,Соблюдать культуру научного и делового общения в устной и письменной форме,931.0,,,,
31,Суффиксы существительных -ЧИК-/ЩИК-,32,Запятая и точка с запятой в бессоюзном сложном предложении,132.0,Придаточные определительные,232.0,,,Употребление однокоренных слов в близком контексте (тавтология),432.0,Наречие,532.0,Анализ содержания текста,632.0,,,,,Соблюдать нормы речевого поведения в разговорной речи,932.0,,,,
