,Древность-Древнерусское государство,Unnamed: 1,"Раздробленность, монголы, возвышение Москвы",Unnamed: 3,Иван Грозный - Смута,Unnamed: 5,Бунташный век - Дворцовые перевороты,Unnamed: 7,Екатерина Вторая - Николай Первый (1762-1855),Unnamed: 9,Александр Второй - Николай Второй (1855-1917),Unnamed: 11,Становление советской Власти и Сталин (1917-1953),Unnamed: 13,Хрущев - Горбачев (1953-1991),Unnamed: 15,Новая Россия,Unnamed: 17,Всемирная История,Unnamed: 19,Навыки и умения,Unnamed: 21
0,"Основные виды деятельности, экономика и земледелие",1.0,Причины раздробленности,101.0,Правление Елены Глинской. Мир с Литвой ,201.0,Причины избрания Михаила Романова,301,Личность Екатерины Второй,401.0,Первые действия Александра II,501.0,II Всероссийский съезд Советов. Первые декреты Советской власти,601.0,Смерть Сталина и борьба за власть после нее,701.0,Личность и становление Ельцина,801.0,Всемирная История до Рюрика,901.0,"Знание основных фактов, процессов и явлений, характеризующих целостность истории",1001.0
1,Славяне,2.0,Плюсы и минусы раздробленности,102.0,Денежная реформа Глинской,202.0,Внутренняя политика Михаила Федоровича ,302,Экономика при Екатерине II,402.0,Великие реформы,502.0,Экономика при Ленине,602.0,Оттепель,702.0,Экономика в 1990-е,802.0,Всемирная история Средних веков,902.0,Умение проводить поиск исторической информации в письменных исторических источниках,1002.0
2,Другие народы на территории страны,3.0,Галицко-Волынское княжество,103.0,"1538-1547 гг. «боярское правление». Бельские, Глинские, Шуйские",203.0,Внешняя политика Михаила Федоровича ,303,Реформы Екатерины II,403.0,Национальная политика Александра II,503.0,Социальная политика большевиков,603.0,Десталинизация,703.0,Причины радикальных экономических реформ,803.0,Западное христианство,903.0,Умение осуществлять внешнюю и внутреннюю критику источника,1003.0
3,Первое протогосударственное образование славян,4.0,Новгородская боярская республика,104.0,Венчание на царство Ивана IV,204.0,Бунты при Алексее Михайловиче,304,Просвещенный абсолютизм,404.0,Кризисы Александра II,504.0,Учредительное Собрание,604.0,Цензура Хрущева,704.0,Приватизация,804.0,Возникновение и развитие ислама,904.0,"Умение анализировать историческую информацию, представленную в разных знаковых системах (работа с картой, таблицей, схемой)",1004.0
4,Племенные союзы восточных славян и их расселение,5.0,Киевское княжество,105.0,Избранная рада,205.0,Соборное уложение,305,Уложенная комиссия,405.0,Общественное мнение Александр II,505.0,Административные изменения большевиков. Ветви власти большевиков,605.0,Экономика при Хрущеве,705.0,Итоги экономических реформ,805.0,Всемирная история XVI-XVII веков,905.0,Умение выстраивать причинно-следственные связи для изучения исторических процессов/событий,1005.0
5,Причины появление государства,6.0,Ростово (Владимиро) - Суздальское княжество,106.0,Земские соборы,206.0,Политика в области торговли при Алексее Михайловиче,306,Жалованные грамоты дворянству и городам,406.0,Общественное движение при Александре Втором,506.0,Политические события при большевикав,606.0,Социальные реформы Хрущева,706.0,Политика в 1990-е,806.0,Всемирная история XVIII века,906.0,Умение систематизировать разнообразную историческую информацию,1006.0
6,Торговые пути,7.0,"Личность Юрия Долгорукого. Походы на Киев, первое упоминание Москвы",107.0,Царский Судебник Ивана Грозного,207.0,Реформы Никона,307,Кризис при Екатерине,407.0,Покушения на Александра II,507.0,Причины начала военного коммунизма,607.0,Научно-технический прогресс при Хрущеве,707.0,Причины политического кризиса 1993 г,807.0,Французская революция XVIII в,907.0,"Знание исторических понятий, умение их использовать",1007.0
7,Соседи славян,8.0,Политика Андрея Боголюбского. Убийство Боголюбского,108.0,Стоглавый собор,208.0,Восстание Степана Разина,308,Пугачевщина,408.0,Убийство Александра II,508.0,Военный коммунизм,608.0,Административные реформы,708.0,Конституция 1993 года,808.0,Война за независимость британских колоний в Северной Америке и образование США,908.0,Умение использовать исторические сведения для аргументации в ходе дискуссии,1008.0
8,Общественный строй,9.0,Архитектурная застройка при Боголюбском,109.0,Приказная система,209.0,Присоединение Левобережной Украины,309,Русско-турецкая война 1768-1774,409.0,Внешняя политика Александра II,509.0,Брестский мир,609.0,Реформа образования,709.0,Появление ГосДумы и Совета Федерации,809.0,Создание колониальных импери,909.0,Знание исторических деятелей,1009.0
9,Призвание варягов,10.0,"Личность Всеволода, его прозвище. Борьба с двоюродными братьями",110.0,Военная реформа Ивана Грозного,210.0,Русско-польская война 1654-1667 гг.,310,Присоединение Крыма,410.0,Русско-турецкая война 1877-1878,510.0,Гражданская Война,610.0,Партия и социализм. Хрущев,710.0,"Сепаратизм Чечни, Татарстана",810.0,"Внутренняя и внешняя политика Османской империи, Индии, Китая, Японии",910.0,Знание дат,1010.0
10,"Норманская, антинорманская и центристская теории",11.0,Княжение Юрия Всеволодовича. Основание Нижнего Новгорода,111.0,Ограничение местничества,211.0,Русско-шведская война 1656-1658 гг.,311,Георгиевский трактат с Грузией,411.0,Завоевание Средней Азии,511.0,Причины Гражданской войны,611.0,Внешняя политика при Хрущеве,711.0,Первая чеченская война,811.0,Политическое и социально-экономическое развитие европейских стран в XIX – начале XX в,911.0,Знание фактов истории культуры,1011.0
11,Язычество славян,12.0,Первое столкновение с монголо-татарами,112.0,Опричнина 1565-1572 гг.,212.0,Освоение Сибири,312,Русско-турецкая война 1787-1791,412.0,Заключение договоров с Японией и Китаем,512.0,Интервенции гражданской войны,612.0,Создание Организации Варшавского договора,712.0,Хасавюртовские соглашения,812.0,Европейские революции XIX в,912.0,"Умение сравнивать исторические события, процессы, явления",1012.0
12,Рюрик,13.0,Монгольская империя,113.0,Присоединение Поволжья,213.0,Экспедиции 17-18 век,313,Русско-шведская война 1788-1790,413.0,Личность Александра Третьего,513.0,Белое движение,613.0,Карибский кризис,713.0,Вторая чеченская война,813.0,Утверждение конституционных и парламентских монархий,913.0,,
13,Поход на Киев в 882. Создание древнерусского государства,14.0,Северо-восточный поход Батыя,114.0,Дипломатия при Грозном,214.0,Русско-турецкая война при Федоре Алексеевиче,314,Разделы Речи Посполитой,414.0,Сподвижники Александра III,514.0,Советско-польская война,614.0,Берлинская стена,714.0,Причины дефолта,814.0,Создание Германской империи,914.0,,
14,Походы на Византию Олега,15.0,Юго-западный поход Батыя,115.0,Начало освоения Сибири,215.0,Внутренняя политика Федора Алексеевича,315,Дипломатия Екатерины II,415.0,Внутренняя политика Александра III,515.0,Причины победы красных,615.0,Смещение Хрущёва,715.0,Последствия Дефолта,815.0,Образование единого государства в Италии,915.0,,
15,Первое столкновение с печенегами,16.0,Нашествия татаро-монголов,116.0,Ливонская война 1558-1583 гг.,216.0,Экономика XVII века,316,Внутренняя политика Павла,416.0,Начало строительства Транссиба,516.0,Новая Экономическая Политика 1921-1928,616.0,Культура при Хрущеве,716.0,Уход Ельцина в отставку,816.0,США в XIX – начале XX в. Гражданская война в США,916.0,,
16,Печенеги,17.0,Неврюева рать,117.0,Введение патриаршества,217.0,Виды крестьян в XVII веке,317,Борьба с идеями Французской революции,417.0,Контрреформы. Культура и образование,517.0,"Образование СССР
",617.0,Сподвижники Брежнева,717.0,Избрание Путина,817.0,Борьба за освобождение и образование независимых государств в Латинской Америке в XIX в,917.0,,
17,Походы на Византию Игоря,18.0,Невская битва,118.0,Урочные лета,218.0,Этапы закрепощения крестьян,318,Военные изменения Павла,418.0,Контрреформы. Самоуправление,518.0,Конституция 1924 г.,618.0,Причины «застоя»,718.0,Личность и становление Путина,818.0,"Политическое и социально-экономическое развитие Османской империи, Индии, Китая, Японии в XIX – начале XX в",918.0,,
18,Восстание древлян. Месть древлянам,19.0,Ледовое побоище,119.0,Тявзинский мир,219.0,Особенности культуры 17 века,319,Изменение принципа престолонаследия Павлом,419.0,Реформы суда Александра III,519.0,«Письма к съезду»,619.0,«Культ без личности»,719.0,Единая Россия,819.0,Антиколониальные движения,919.0,,
19,Налоговая реформа Ольги,20.0,Образование Золотой Орды,120.0,Причины смуты,220.0,Литература 17 века,320,Крестьянский вопрос при Павле,420.0,Крестьянский вопрос при Александре III,520.0,Внутрипартийная борьба за власть,620.0,Номенклатура,720.0,Теракты,820.0,Мир накануне Первой мировой войны,920.0,,
20,Крещение Ольги,21.0,Ордынское иго на Руси,121.0,Избрание Годунова,221.0,Архитектура 17 века,321,Антидворянская политика,421.0,Рабочий вопрос при Александре III,521.0,Внешняя политика 1920-х,621.0,Развитой социализм,721.0,Политика 2000х,821.0,"Первая мировая война: причины, состав участников, основные этапы и события, итоги",921.0,,
21,Осада печенегами Киева,22.0,Русь и Литва,122.0,Борис Годунов,222.0,Образование 17 века,322,Внешняя политика Павла,422.0,Внешняя политика Александра III,522.0,Наркомы иностранных дел ,622.0,Последствия принятия Конституции,722.0,Укрепление вертикали власти при Путине,822.0,Революционная волна после Первой мировой войны. Версальско-Вашингтонская система,922.0,,
22,Походы Святослава на Волжскую Булгарию,23.0,Образование Литвы. Союзы Польши и Литвы,123.0,Восстание Хлопка,223.0,Живопись 17 века,323,Убийство Павла. Причины заговора 1801 г.,423.0,"Противостояние с Австрией, Германией",523.0,Коминтерн,623.0,Экономика при Брежневе,723.0,Экономика при Путине,823.0,Страны Запада в 1920-е гг,923.0,,
23,Разгром Хазарского каганата,24.0,Причины Возвышения Москвы,124.0,Борьба с Лжедмитрием,224.0,Внутренняя политика Софьи Алексеевны,324,Особенности культуры 18 века,424.0,"Присоединение Средней
 Азии",524.0,Полоса признания,624.0,Экономическая реформа Косыгина,724.0,Итог политики 2000х,824.0,Фашизм. Итальянский фашизм,924.0,,
24,Походы на Болгарское царство,25.0,"Княжение Даниила Александровича. Присоединение: Коломны, Переяславля, Можайска",125.0,Федор Борисович,225.0,Хованщина,325,Литература 18 века,425.0,Общественное движение,525.0,Индустриализация,625.0,Причины реформы 1965 года,725.0,Эпоха тандема,825.0,Национально-освободительное движение в странах Востока,925.0,,
25,"Усобица: Ярополк, Олег, Владимир",26.0,Союз с церковью Юрия Даниловича,126.0,Битва при Кромах,226.0,Внешняя политика Софьи,326,Архитектура 18 века,426.0,Экономика при Николае II,526.0,Цели и особенности индустриализации,626.0,"Реформа в сельском хозяйстве, промышленности",726.0,Третий президентский срок Путина,826.0,Великая депрессия и альтернативные пути выхода из мирового кризиса,926.0,,
26,Крещение Владимира. Крещение Руси,27.0,Борьба с Тверью. Карательный поход на Тверь. Получение права сбора дани,127.0,Лжедмитрий 1. Личность Григория Отрепьева,227.0,Детство Петра 1,327,Наука 18 века,427.0,Мировой экономический кризис,527.0,Первая пятилетка,627.0,Причины свертывания реформы,727.0,Внешняя политика в 1990-е - 2000-е,827.0,«Новый курс»,927.0,,
27,Языческая реформа,28.0,Постройка деревянного Кремля,128.0,Поход на Москву Лжедмитрия,228.0,Азовские походы,328,Живопись 18 века,428.0,Внешняя политика в 1890-е-1900-е,528.0,Вторая пятилетка,628.0,Восьмая (Золотая) пятилетка,728.0,Интеграция на постсоветском пространстве,828.0,Германский нацизм,928.0,,
28,Междоусобица после смерти Владимира Первого,29.0,Перенос митрополии из Владимира в Москву,129.0,Политика Лжедмитрия Первого,229.0,Великое посольство ,329,Негласный комитет,429.0,Деятельность Витте,529.0,Третья пятилетка,629.0,Девятая пятилетка,729.0,Взаимоотношения с Западом после распада СССР,829.0,Японский милитаризм,929.0,,
29,Разгром печенегов,30.0,Борьба с Литвой Симеона Гордого,130.0,Переворот Василия Шуйского,230.0,Стрелецкий бунт,330,Либеральные реформы Александра I,430.0,Деятельность Плеве,530.0,Итоги индустриализации,630.0,Десятая пятилетка,730.0,Зимние Олимпийские игры в Сочи,830.0,"«Народный фронт». Нарастание
агрессии",930.0,,
30,Правда Ярослава. Лествичный порядок,31.0,Правление Ивана Красного,131.0,Крестоцеловальная запись,231.0,Рекрутская реформа,331,Крестьянский вопрос при Александре I,431.0,Первая русская революция,531.0,«Классовые враги». Репрессии. Культ личности,631.0,Одиннадцатая пятилетка,731.0,Вхождение Крыма и Севастополя в состав РФ,831.0,Политика «умиротворения» и её последствия,931.0,,
31,Митрополит Иларион,32.0,Битва на р. Пьяне и Воже. Куликовская битва,132.0,Угличское дело. Смерть царевича Дмитрия,232.0,Европеизация при Петре Первом,332,Деятельность Сперанского,432.0,Рабочий вопрос при Николае II,532.0,Коллективизация,632.0,Социальные реформы Брежнева,732.0,Культура Новой России,832.0,Мир накануне Второй мировой войны,932.0,,
32,Триумвират Ярославичей. Правда Ярославичей,33.0,Набег Тохтамыша на Москву,133.0,Избрание Шуйского,233.0,Северная война,333,Аракчеевщина. Консерватизм,433.0,Национальный вопрос при Николае II,533.0,Итоги коллективизации,633.0,Национальные движения,733.0,Ельцин внутренняя политика,833.0,"Вторая мировая война: причины, состав участников, основные этапы и события, итоги",933.0,,
33,Борьба с половцами. Битва на Альте 1068 г.,34.0,Походы Ольгерда на Москву,134.0,Восстание Болотникова,234.0,Каспийский и Персидский поход,334,Декабристы,434.0,Крестьянский вопрос при Николае II,534.0,Конституция 1936 г.,634.0,Итоги руководства Брежнева,734.0,Ельцин внешняя политика,834.0,Власть и общество в годы войны,934.0,,
34,Святополк Изяславич,35.0,Роль Сергия Радонежского,135.0,Лжедмитрий 2,235.0,Социально-экономические реформы,335,Антифранцузские коалиции,435.0,Партии. РСДРП. Эсеры,535.0,Церковь при Сталине,635.0,Внешняя политика при Брежневе,735.0,Путин внутренняя политика 2000-2008 гг. и 2012-2014 гг.,835.0,Перемены в мире под влиянием победы во Второй мировой войне над силами реакции и агрессии,935.0,,
35,Любечский съезд,36.0,Поход на Тверь Дмитрия Донского,136.0,Осада Троице-Сергиева монастыря,236.0,Административные реформы,336,Тильзитский мир,436.0,Русско-японская война,536.0,Подготовка к войне,636.0,«Пражская весна»,736.0,Эпоха тандема 2008-2012 гг.,836.0,Экономические и политические изменения в странах Запада,936.0,,
36,Походы против половцев,37.0,"Книгописание, летописание 12-14 вв",137.0,Семибоярщина,237.0,Военные реформы,337,Отечественная война,437.0,Революция 1905-1907,537.0,Вхождение республик в СССР,637.0,Разрядка,737.0,Путин внешняя политика,837.0,Национально-освободительное движение в странах Востока,937.0,,
37,Антиростовщическое восстание в Киеве 1113 г.,38.0,Литература 12-14 вв,138.0,Переворот во главе с Ляпуновым,238.0,Вопрос о престолонаследии,338,Заграничные походы,438.0,Деятельность Госдумы при Николае II,538.0,Внешняя политика 1930-х,638.0,Ввод войск в афганистан,738.0,Литература второй половины 20 века - начала 21 века,838.0,Распад колониальных империй и его последстви,938.0,,
38,Устав Владимира Мономаха,39.0,Зодчество 12-14 вв,139.0,Патриарх Гермоген,239.0,Восстание Кондратия Булавина,339,Венский конгресс,439.0,Третьеиюньская монархия,539.0,Причины изменения внешней политики 1930-х,639.0,Культура при Брежневе,739.0,Архитектура второй половины 20 века - начала 21 века,839.0,"Мировая система социализма: зарождение, основные этапы развития",939.0,,
