20,Уравнения скорости координаты и ускорения  для движения тела брошенного под углом к горизонту,37.0,,,,,,,,,Плавление и кристаллизация.  Удельная теплота плавления,530,,,,,,,,,,,Инвариантность модуля скорости света в вакууме,1132.0,,
21,"Дальность  полета, время полета(подъема), высота подъема тела брошенного под углом к горизонту",38.0,,,,,,,,,Внутренняя энергия сгорания топлива. Удельная теплота сгорания топлива,533,,,,,,,,,,,"Следствия из постулатов СТО: сокращение длин, замедление промежутков времени, относительность одновременности событий",1134.0,,
22,"Графики зависимости от времени для проекции ускорения, проекции скорости и координаты при движении тела брошенного под углом к горизонту",40.0,,,,,,,,, Количество теплоты при нагревании/охлаждении. Удельная теплоемкость тел,536,,,,,,,,,,,Релятивистский закон сложения скоростей,1135.0,,
23,Формула центростремительного ускорения при равномерном движении по окружности,44.0,,,,,,,,,"Анализ процессов нагревания/охлаждения, фазовых переходов по графикам t(Q), t(τ)",537,,,,,,,,,,,Энергия свободной частицы,1136.0,,
24,Связь линейной и угловой скорости,45.0,,,,,,,,,Закон сохранения энергии в тепловых процессах. Уравнение теплового баланса,539,,,,,,,,,,,Импульс частицы,1137.0,,
25,"Формула, связывающая период и частоту обращения",46.0,,,,,,,,," Работа в изобарном и изохорном процессе, знак работы (зависимость от изменения объема)",540,,,,,,,,,,,Связь массы и энергии свободной частицы,1138.0,,
26,Формула для вычисления скорости через радиус окружности и период обращени,47.0,,,,,,,,,Вычисление работы по графику процесса на pV-диаграмме (площадь фигуры под графиком),541,,,,,,,,,,,Кинетическая энергия релятивистской частицы,1139.0,,
27,,,,,,,,,,,Первый закон термодинамики,542,,,,,,,,,,,Энергия покоя свободной частицы,1140.0,,
28,,,,,,,,,,,Адиабатный процесс. График адиабатного процесса,544,,,,,,,,,,,,,,
29,,,,,,,,,,,"Обычные тепловые машины, связь теплот и работы, КПД",545,,,,,,,,,,,,,,
30,,,,,,,,,,,Замкнутый цикл. Нахождение работы за цикл как площадь фигуры внутри цикла,547,,,,,,,,,,,,,,
31,,,,,,,,,,,"Идеальная тепловая машина, цикл Карно, его КПД",548,,,,,,,,,,,,,,
